{
  "artifact_metadata": {
    "artifact_type": "code_review_closure",
    "version": "1.0.0",
    "timestamp": "2026-01-01T17:00:00Z",
    "session_id": "session-example-001",
    "pr_number": null
  },
  "what_was_reviewed": {
    "files": [
      "governance/schemas/code-review-closure-schema.json",
      "scripts/validate_code_review_closure.py",
      ".github/workflows/code-review-closure-gate.yml"
    ],
    "components": [
      "Code Review Artifact Validation",
      "CI Enforcement"
    ],
    "summary": "Reviewed implementation of machine-verifiable code review closure artifact system including schema, validation script, and CI gate"
  },
  "review_findings": [
    {
      "category": "none",
      "description": "No issues found - implementation follows governance requirements",
      "severity": "informational"
    }
  ],
  "what_changed_after_review": {
    "changes_made": [],
    "unaddressed_findings": []
  },
  "final_verdict": {
    "status": "APPROVED",
    "reasoning": "All changes are minimal, focused, and correctly implement the required code review closure artifact validation as specified in Issue 2. Schema is complete, validation is comprehensive, and CI gate enforces the requirement.",
    "reviewer": "FMRepoBuilder"
  },
  "immutable": true
}
